### ISSUE TITLE
Allow unlimited time to pass between C/R of TCP-connected containers

### ISSUE THREAD

**Issue by dav-ell** [checkpoint-restore/criu#451]
Based on discussion in #448, CRIU restores the timestamps of TCP connections to the values they were at when checkpointed. It seems that if these values were changed to the time at which the restore occurs, then TCP-connected containers could continue to have a working connection even after an unlimited amount of time had passed between the checkpoint and eventual restore.

After a `criu dump` and a `crit decode` of `files.img`, I found the following section:
```
{
            "type": "INETSK", 
            "id": 78, 
            "isk": {
                "id": 78, 
                "ino": 1641535, 
                "family": "INET6", 
                "type": "STREAM", 
                "proto": "TCP", 
                "state": "ESTABLISHED", 
                "src_port": 25565, 
                "dst_port": 39700, 
                "flags": "0x802", 
                "backlog": 0, 
                "src_addr": [
                    "::ffff:7f00:1"
                ], 
                "dst_addr": [
                    "::ffff:7f00:1"
                ], 
                "fown": {
                    "uid": 0, 
                    "euid": 0, 
                    "signum": 0, 
                    "pid_type": 0, 
                    "pid": 0
                }, 
                "opts": {
                    "so_sndbuf": 2626560, 
                    "so_rcvbuf": 1062000, 
                    "so_snd_tmo_sec": 0, 
                    "so_snd_tmo_usec": 0, 
                    "so_rcv_tmo_sec": 0, 
                    "so_rcv_tmo_usec": 0, 
                    "reuseaddr": true, 
                    "so_priority": 0, 
                    "so_rcvlowat": 1, 
                    "so_mark": 0, 
                    "so_passcred": false, 
                    "so_passsec": false, 
                    "so_dontroute": false, 
                    "so_no_check": false, 
                    "so_reuseport": false
                }, 
                "v6only": false, 
                "ip_opts": {}
            }
        }
```

I was looking to edit the timestamp and then `crit encode` it back to see if this solution would work, but I don't see anything that would suggest it could pass as a timestamp.

Decoded files.img: [files.json.txt](https://github.com/checkpoint-restore/criu/files/1803687/files.json.txt)

There was also a single tcp-stream-*.img file: [tcp-stream-190c3f.json.txt](https://github.com/checkpoint-restore/criu/files/1803689/tcp-stream-190c3f.json.txt)

**Comment by adrianreber** [comment]
There are timestamps in the tcp-stream file. Did you try changing those?

**Comment by dav-ell** [comment]
@adrianreber It's not clear what the value of the timestamp in tcp-stream should be. The timestamp looks like a time since epoch, but it's definitely not the actual Unix epoch time -- we're currently at 1520878903 or so and the timestamp is 1965427541.

I did try changing the timestamp arbitrarily to be 10000 or so higher in all the tcp-stream files between the two containers. The client continued running, with a socket timeout. The server errored out and died.

**Comment by avagin** [comment]
I think you misunderstood the idea of this timestamp. This timestamp doesn't affect timeouts when a connection will be dropped.

> TCP timestamps are used to provide protection against wrapped sequence numbers.

And it is incorrect to say that criu restore this timestamp on restore, CRIU set a delta between the current tcp timestamp in a system and a timestamp of a restored tcp connection. 

https://lists.openvz.org/pipermail/criu/2013-February/007342.html

**Comment by avagin** [comment]
```
15:32:26.438787 IP localhost.10002 > localhost.37366: Flags [.], ack 3275, win 3071, options [nop,nop,TS val 3146820260 ecr 3146820260], length 0
15:32:26.498582 IP localhost.10002 > localhost.37366: Flags [P.], seq 22428:22531, ack 3275, win 3071, options [nop,nop,TS val 3146820320 ecr 3146820260], length 103
15:32:26.498626 IP localhost.10002 > localhost.37366: Flags [P.], seq 22531:22598, ack 3275, win 3071, options [nop,nop,TS val 3146820320 ecr 3146820260], length 67
15:32:26.499334 IP localhost.37366 > localhost.10002: Flags [.], ack 22598, win 24576, options [nop,nop,TS val 3146820321 ecr 3146820320], length 0
15:32:26.513087 IP localhost.37366 > localhost.10002: Flags [P.], seq 3275:3299, ack 22598, win 24576, options [nop,nop,TS val 3146820335 ecr 3146820320], length 24
15:32:26.520001 IP localhost.10002 > localhost.37366: Flags [.], ack 3299, win 3071, options [nop,nop,TS val 3146820342 ecr 3146820335], length 0
15:32:30.686795 IP localhost.37366 > localhost.10002: Flags [P.], seq 3299:3314, ack 22598, win 24576, options [nop,nop,TS val 3146824508 ecr 3146820342], length 15
15:32:30.900739 IP localhost.37366 > localhost.10002: Flags [P.], seq 3299:3314, ack 22598, win 24576, options [nop,nop,TS val 3146824722 ecr 3146820342], length 15
15:32:31.116946 IP localhost.37366 > localhost.10002: Flags [P.], seq 3299:3314, ack 22598, win 24576, options [nop,nop,TS val 3146824938 ecr 3146820342], length 15
15:32:31.576024 IP localhost.37366 > localhost.10002: Flags [P.], seq 3299:3314, ack 22598, win 24576, options [nop,nop,TS val 3146825398 ecr 3146820342], length 15
15:32:32.436521 IP localhost.37366 > localhost.10002: Flags [P.], seq 3299:3314, ack 22598, win 24576, options [nop,nop,TS val 3146826258 ecr 3146820342], length 15
15:32:34.165775 IP localhost.37366 > localhost.10002: Flags [P.], seq 3299:3314, ack 22598, win 24576, options [nop,nop,TS val 3146827987 ecr 3146820342], length 15
15:32:37.749383 IP localhost.37366 > localhost.10002: Flags [P.], seq 3299:3314, ack 22598, win 24576, options [nop,nop,TS val 3146831571 ecr 3146820342], length 15
15:32:44.662201 IP localhost.37366 > localhost.10002: Flags [P.], seq 3299:3314, ack 22598, win 24576, options [nop,nop,TS val 3146838484 ecr 3146820342], length 15
15:32:58.485062 IP localhost.37366 > localhost.10002: Flags [P.], seq 3299:3314, ack 22598, win 24576, options [nop,nop,TS val 3146852307 ecr 3146820342], length 15
15:33:27.156274 IP localhost.37366 > localhost.10002: Flags [P.], seq 3299:3314, ack 22598, win 24576, options [nop,nop,TS val 3146880978 ecr 3146820342], length 15
15:33:31.632304 IP localhost.37366 > localhost.10002: Flags [FP.], seq 3314:3550, ack 22598, win 24576, options [nop,nop,TS val 3146885454 ecr 3146820342], length 236



15:52:17.298811 IP localhost.10002 > localhost.37366: Flags [.], ack 3299, win 3071, options [nop,nop,TS val 3146822243 ecr 0], length 0
15:52:17.298831 IP localhost.37366 > localhost.10002: Flags [R], seq 3516504597, win 0, length 0
```

**Comment by avagin** [comment]
From the previous tcpdump, we can see that localhost.10002 was dumped between 15:32:26-15:32:30, but localhost.37366 continued working for more then one minutes.

**Comment by avagin** [comment]
Here is one more suspicion moment is that the reset packet was sent with a strange seq number (3516504597). It is not absolute number, because tcpdump was executed without --absolute-tcp-sequence-numbers

**Comment by dav-ell** [comment]
> Here is one more suspicion moment is that the reset packet was sent with a strange seq number (3516504597). It is not absolute number, because tcpdump was executed without --absolute-tcp-sequence-numbers

This answers my question about why I was seeing strange timestamps earlier. I'm still not quite clear on what determines the socket timing out, though. You mentioned that the timestamps don't determine the timeout... what does then?

**Comment by dav-ell** [comment]
> Here is one more suspicion moment is that the reset packet was sent with a strange seq number (3516504597).

@avagin You may have been looking at a bad tcpdump for this one. That was from the first dump I took. The later ones are more reliable and from working C/Rs. The 2nd dump in #448 is from a working dump. The 3rd is from one that purposely failed.

**Comment by avagin** [comment]
> Thanks for the help so far, @adrianreber. It looks like you're right. I tested this with a longer delay between checkpoint and restore, ~1 min, and it timed out. The checkpoint/restore happens around 10:23:00 and 10:24:00.
> 
> tcpdump.log

In this tcpdump, I don't see connections which were timed out.

Here is tcpdump for a connection which was C/R and we see that it was closed normally by sending fin packets in both directions.
```
10:23:00.633500 IP localhost.25565 > localhost.39270: Flags [P.], seq 12431:12437, ack 113, win 350, options [nop,nop,TS val 1959967450 ecr 1959967447], length 6
10:23:00.633522 IP localhost.25565 > localhost.39270: Flags [P.], seq 12437:12443, ack 113, win 350, options [nop,nop,TS val 1959967450 ecr 1959967447], length 6
10:23:00.633546 IP localhost.25565 > localhost.39270: Flags [P.], seq 12443:12457, ack 113, win 350, options [nop,nop,TS val 1959967450 ecr 1959967447], length 14
10:23:00.633568 IP localhost.25565 > localhost.39270: Flags [P.], seq 12457:12463, ack 113, win 350, options [nop,nop,TS val 1959967450 ecr 1959967447], length 6
10:23:00.633744 IP localhost.39270 > localhost.25565: Flags [.], ack 12463, win 18935, options [nop,nop,TS val 1959967450 ecr 1959967449], length 0
10:23:00.640910 IP localhost.39270 > localhost.25565: Flags [P.], seq 113:141, ack 12463, win 18935, options [nop,nop,TS val 1959967458 ecr 1959967449], length 28
10:23:00.676950 IP localhost.25565 > localhost.39270: Flags [P.], seq 12463:12471, ack 141, win 350, options [nop,nop,TS val 1959967494 ecr 1959967458], length 8
10:23:00.678113 IP localhost.25565 > localhost.39270: Flags [P.], seq 12471:12479, ack 141, win 350, options [nop,nop,TS val 1959967495 ecr 1959967458], length 8
10:23:00.678208 IP localhost.39270 > localhost.25565: Flags [.], ack 12479, win 18935, options [nop,nop,TS val 1959967495 ecr 1959967494], length 0



10:23:59.878882 IP localhost.25565 > localhost.39270: Flags [.], ack 141, win 1024, options [nop,nop,TS val 1959968253 ecr 0], length 0
10:23:59.956352 IP localhost.25565 > localhost.39270: Flags [F.], seq 12479, ack 141, win 1024, options [nop,nop,TS val 1959968330 ecr 0], length 0
10:24:00.170942 IP localhost.25565 > localhost.39270: Flags [F.], seq 12479, ack 141, win 1024, options [nop,nop,TS val 1959968545 ecr 0], length 0
10:24:00.382857 IP localhost.25565 > localhost.39270: Flags [F.], seq 12479, ack 141, win 1024, options [nop,nop,TS val 1959968757 ecr 0], length 0
10:24:00.516289 IP localhost.39270 > localhost.25565: Flags [.], ack 12479, win 18935, options [nop,nop,TS val 1959971501 ecr 0], length 0
10:24:00.516297 IP localhost.25565 > localhost.39270: Flags [.], ack 141, win 1024, options [nop,nop,TS val 1959968890 ecr 0], length 0
10:24:00.637185 IP localhost.39270 > localhost.25565: Flags [F.], seq 141, ack 12479, win 18935, options [nop,nop,TS val 1959971622 ecr 0], length 0
10:24:00.637201 IP localhost.25565 > localhost.39270: Flags [.], ack 142, win 1024, options [nop,nop,TS val 1959969011 ecr 1959971622], length 0
10:24:00.811026 IP localhost.25565 > localhost.39270: Flags [F.], seq 12479, ack 142, win 1024, options [nop,nop,TS val 1959969185 ecr 1959971622], length 0
10:24:00.811076 IP localhost.39270 > localhost.25565: Flags [.], ack 12480, win 18935, length 0
```

**Comment by avagin** [comment]
Maybe a program which uses this connections has its internal timeouts?

**Comment by avagin** [comment]
> This answers my question about why I was seeing strange timestamps earlier. I'm still not quite clear on what determines the socket timing out, though. You mentioned that the timestamps don't determine the timeout... what does then?

Each tcp socket has information when each packet in a send queue was sent, when it has to be re-transmitted and how many times it can be retransmited. When CRIU restores a packet in a send queue, the logic about re-transmitting packets works so as it would be a new packet.

**Comment by avagin** [comment]
For example, lets imaging that we have a tcp socket which has un-acked data in a sent queue, which were sent N minutes ago, and without C/R it will timed out in M minutes. If we dump and restore this socket, all timers will be initialized again, and a restored socket will timed out in N + M minutes.

**Comment by dav-ell** [comment]
> Here is tcpdump for a connection which was C/R and we see that it was closed normally by sending fin packets in both directions. Maybe a program which uses this connections has its internal timeouts?

This was indeed the case. It turned out the server was aware of the system time, and if the difference between the time it last remembered seeing and the current time was off by more than one minute it would disconnect all clients and crash. I disabled that feature and it stopped crashing.

However, even though it doesn't crash, they still actively disconnect for some reason. Here's the relevant segment:
```
14:46:01.805105 IP localhost.25565 > localhost.40838: Flags [P.], seq 1171438:1171444, ack 671, win 350, options [nop,nop,TS val 2000819050 ecr 2000819050], length 6
14:46:01.805111 IP localhost.40838 > localhost.25565: Flags [.], ack 1171444, win 19958, options [nop,nop,TS val 2000819050 ecr 2000819050], length 0
14:46:01.851539 IP localhost.25565 > localhost.40838: Flags [P.], seq 1171444:1171452, ack 671, win 350, options [nop,nop,TS val 2000819096 ecr 2000819050], length 8
14:46:01.851557 IP localhost.40838 > localhost.25565: Flags [.], ack 1171452, win 19958, options [nop,nop,TS val 2000819096 ecr 2000819096], length 0
14:46:01.876267 IP localhost.25565 > localhost.40838: Flags [P.], seq 1171452:1171465, ack 671, win 350, options [nop,nop,TS val 2000819121 ecr 2000819096], length 13
14:46:01.876351 IP localhost.25565 > localhost.40838: Flags [P.], seq 1171465:1171470, ack 671, win 350, options [nop,nop,TS val 2000819121 ecr 2000819096], length 5
14:46:01.876413 IP localhost.25565 > localhost.40838: Flags [P.], seq 1171470:1171475, ack 671, win 350, options [nop,nop,TS val 2000819121 ecr 2000819096], length 5
14:46:01.876495 IP localhost.25565 > localhost.40838: Flags [P.], seq 1171475:1171487, ack 671, win 350, options [nop,nop,TS val 2000819121 ecr 2000819096], length 12
14:46:01.876558 IP localhost.25565 > localhost.40838: Flags [P.], seq 1171487:1171499, ack 671, win 350, options [nop,nop,TS val 2000819121 ecr 2000819096], length 12
14:46:01.876619 IP localhost.25565 > localhost.40838: Flags [P.], seq 1171499:1171505, ack 671, win 350, options [nop,nop,TS val 2000819121 ecr 2000819096], length 6
14:46:01.876702 IP localhost.25565 > localhost.40838: Flags [P.], seq 1171505:1171519, ack 671, win 350, options [nop,nop,TS val 2000819121 ecr 2000819096], length 14
14:46:01.876762 IP localhost.25565 > localhost.40838: Flags [P.], seq 1171519:1171525, ack 671, win 350, options [nop,nop,TS val 2000819122 ecr 2000819096], length 6
14:46:01.876824 IP localhost.25565 > localhost.40838: Flags [P.], seq 1171525:1171539, ack 671, win 350, options [nop,nop,TS val 2000819122 ecr 2000819096], length 14
14:46:01.876885 IP localhost.25565 > localhost.40838: Flags [P.], seq 1171539:1171545, ack 671, win 350, options [nop,nop,TS val 2000819122 ecr 2000819096], length 6
14:46:01.891508 IP localhost.25565 > localhost.40838: Flags [P.], seq 1171545:1171591, ack 671, win 350, options [nop,nop,TS val 2000819136 ecr 2000819096], length 46
14:46:01.923487 IP localhost.40838 > localhost.25565: Flags [.], ack 1171591, win 19957, options [nop,nop,TS val 2000819136 ecr 2000819121], length 0


14:47:32.431716 IP localhost.25565 > localhost.40838: Flags [.], ack 671, win 1024, options [nop,nop,TS val 2000820013 ecr 0], length 0
14:47:32.534576 IP localhost.25565 > localhost.40838: Flags [F.], seq 1171591, ack 671, win 1024, options [nop,nop,TS val 2000820116 ecr 0], length 0
14:47:32.744604 IP localhost.25565 > localhost.40838: Flags [F.], seq 1171591, ack 671, win 1024, options [nop,nop,TS val 2000820326 ecr 0], length 0
14:47:32.877626 IP localhost.40838 > localhost.25565: Flags [.], ack 1171591, win 19957, options [nop,nop,TS val 2000825898 ecr 0], length 0
14:47:32.877639 IP localhost.25565 > localhost.40838: Flags [.], ack 671, win 1024, options [nop,nop,TS val 2000820459 ecr 0], length 0
14:47:32.947520 IP localhost.25565 > localhost.40838: Flags [F.], seq 1171591, ack 671, win 1024, options [nop,nop,TS val 2000820529 ecr 0], length 0
14:47:32.952701 IP localhost.40838 > localhost.25565: Flags [.], ack 1171592, win 19957, options [nop,nop,TS val 2000825968 ecr 2000820529], length 0
14:47:33.064002 IP localhost.40838 > localhost.25565: Flags [R.], seq 671, ack 1171592, win 19957, options [nop,nop,TS val 2000826085 ecr 2000820529], length 0
```
I might be wrong, but this seems to be a [half-duplex close sequence](https://en.wikipedia.org/wiki/Transmission_Control_Protocol).

Obviously I'm more interested in getting the idea of this working than the individual application, so if you have a suggestion for something to test, I'm happy to try it.

**Comment by dav-ell** [comment]
> For example, lets imaging that we have a tcp socket which has un-acked data in a sent queue, which were sent N minutes ago, and without C/R it will timed out in M minutes. If we dump and restore this socket, all timers will be initialized again, and a restored socket will timed out in N + M minutes.

This sounds close to the solution I'm looking for. Just to clarify then, is there a theoretical limit to the amount of time _between the dump and restore_ that is allowed and the connection still to work when it gets restored? It sounds like there isn't supposed to be, if the timers are getting reset on restore.

**Comment by avagin** [comment]
> This sounds close to the solution I'm looking for. Just to clarify then, is there a theoretical limit to the amount of time between the dump and restore that is allowed and the connection still to work when it gets restored? It sounds like there isn't supposed to be, if the timers are getting reset on restore.

There is not a limit for a case when both sides of a connection is dumped and restored. In this case, a connection has to be correctly restored in any time.

**Comment by avagin** [comment]
> I might be wrong, but this seems to be a half-duplex close sequence.
In your tcpdump, fin packets were sent in both directions, so both sides closed this connection properly, it means that the connection didn't timed out, the applications called close() for  sockets.

**Comment by dav-ell** [comment]
> There is not a limit for a case when both sides of a connection is dumped and restored. In this case, a connection has to be correctly restored in any time.

Thank you for the clarity on this. I believed you and went and tried a different application. This one is communication between a RabbitMQ client and server. I waited ~25 minutes between the checkpoint and restore and it worked just fine. Here's the tcpdump:

```
17:57:25.569168 IP 127.0.0.1.5672 > 127.0.0.1.41180: Flags [.], ack 896, win 350, options [nop,nop,TS val 2044382265 ecr 2044382265], length 0
17:57:26.570230 IP 127.0.0.1.41180 > 127.0.0.1.5672: Flags [P.], seq 896:918, ack 1, win 350, options [nop,nop,TS val 2044383266 ecr 2044382265], length 22
17:57:26.570281 IP 127.0.0.1.41180 > 127.0.0.1.5672: Flags [P.], seq 918:940, ack 1, win 350, options [nop,nop,TS val 2044383266 ecr 2044382265], length 22
17:57:26.570303 IP 127.0.0.1.41180 > 127.0.0.1.5672: Flags [P.], seq 940:960, ack 1, win 350, options [nop,nop,TS val 2044383266 ecr 2044382265], length 20
17:57:26.570449 IP 127.0.0.1.5672 > 127.0.0.1.41180: Flags [.], ack 960, win 350, options [nop,nop,TS val 2044383266 ecr 2044383266], length 0
17:57:27.573142 IP 127.0.0.1.41180 > 127.0.0.1.5672: Flags [P.], seq 960:982, ack 1, win 350, options [nop,nop,TS val 2044384269 ecr 2044383266], length 22
17:57:27.573193 IP 127.0.0.1.41180 > 127.0.0.1.5672: Flags [P.], seq 982:1004, ack 1, win 350, options [nop,nop,TS val 2044384269 ecr 2044383266], length 22
17:57:27.573220 IP 127.0.0.1.41180 > 127.0.0.1.5672: Flags [P.], seq 1004:1024, ack 1, win 350, options [nop,nop,TS val 2044384269 ecr 2044383266], length 20
17:57:27.573376 IP 127.0.0.1.5672 > 127.0.0.1.41180: Flags [.], ack 1024, win 350, options [nop,nop,TS val 2044384269 ecr 2044384269], length 0


18:22:01.182592 IP 127.0.0.1.41180 > 127.0.0.1.5672: Flags [.], ack 1, win 1024, options [nop,nop,TS val 2044384799 ecr 0], length 0
18:22:01.451826 IP 127.0.0.1.5672 > 127.0.0.1.41180: Flags [.], ack 1024, win 1024, options [nop,nop,TS val 2044385239 ecr 0], length 0
18:22:01.451832 IP 127.0.0.1.41180 > 127.0.0.1.5672: Flags [.], ack 1, win 1024, options [nop,nop,TS val 2044385068 ecr 0], length 0
18:22:01.958372 IP 127.0.0.1.41180 > 127.0.0.1.5672: Flags [P.], seq 1024:1046, ack 1, win 1024, options [nop,nop,TS val 2044385574 ecr 0], length 22
18:22:01.958411 IP 127.0.0.1.5672 > 127.0.0.1.41180: Flags [.], ack 1046, win 1024, options [nop,nop,TS val 2044385745 ecr 2044385574], length 0
18:22:01.958449 IP 127.0.0.1.41180 > 127.0.0.1.5672: Flags [P.], seq 1046:1068, ack 1, win 1024, options [nop,nop,TS val 2044385574 ecr 2044385745], length 22
18:22:01.958464 IP 127.0.0.1.5672 > 127.0.0.1.41180: Flags [.], ack 1068, win 1024, options [nop,nop,TS val 2044385745 ecr 2044385574], length 0
18:22:01.958495 IP 127.0.0.1.41180 > 127.0.0.1.5672: Flags [P.], seq 1068:1088, ack 1, win 1024, options [nop,nop,TS val 2044385574 ecr 2044385745], length 20
18:22:01.958506 IP 127.0.0.1.5672 > 127.0.0.1.41180: Flags [.], ack 1088, win 1024, options [nop,nop,TS val 2044385745 ecr 2044385574], length 0
18:22:01.958751 IP 127.0.0.1.41180 > 127.0.0.1.5672: Flags [P.], seq 1088:1096, ack 1, win 1024, options [nop,nop,TS val 2044385575 ecr 2044385745], length 8
18:22:01.958758 IP 127.0.0.1.5672 > 127.0.0.1.41180: Flags [.], ack 1096, win 1024, options [nop,nop,TS val 2044385746 ecr 2044385575], length 0
18:22:02.960240 IP 127.0.0.1.41180 > 127.0.0.1.5672: Flags [P.], seq 1096:1118, ack 1, win 1024, options [nop,nop,TS val 2044386576 ecr 2044385746], length 22
18:22:02.960276 IP 127.0.0.1.5672 > 127.0.0.1.41180: Flags [.], ack 1118, win 1024, options [nop,nop,TS val 2044386747 ecr 2044386576], length 0
```

**Comment by dav-ell** [comment]
Before I close this @avagin, is there any concern about CRIU failing in the first application I used? It was actually just a simple Minecraft client/server. It seems to me that CRIU's goal is to C/R **any** application transparently, so I just wanted to make sure that Minecraft failing like it did isn't actually a big problem.

**Comment by avagin** [comment]
@dav-ell You are right, CRIU has an issue here, but this issue isn't about tcp connections, it is about time and timers. And we can't fix this issue without some support from the kernel:

https://criu.org/Time_namespace

Here is one more issue with a similar problem:
https://github.com/checkpoint-restore/criu/issues/296

**Comment by avagin** [comment]
I know that this problem is solved in OpenVZ (Virtuozzo). As for the upstream kernel, I don't have any information.

**Comment by brauner** [comment]
You should talk to @adrianreber!

**Comment by dav-ell** [comment]
@brauner I think I would definitely be interested in that! What's the best way to contact @adrianreber?
