### ISSUE TITLE
Changing established TCP connection details results in "Connection reset by peer"

### ISSUE THREAD

**Issue by dav-ell** [checkpoint-restore/criu#454]
This is a progression from #451, but instead of C/Ring two containers on the same host, I'm checkpointing two containers on different hosts and restoring them on opposite hosts after changing their TCP connection information using `crit`. One container is a RabbitMQ server. The other is a RabbitMQ client. Both client and server are located in the same local network. Network namespaces are disabled for both. Here are the steps I'm taking:

1. Start container A (client) on host X. Start container B (server) on host Y.
2. Checkpoint A and B simultaneously, each with `sudo runc checkpoint [container] ... --tcp-established`.
3. Copy A's (client) checkpoint to Y. Copy B's (server) checkpoint to X.
4. `sudo crit decode -i files.img --pretty -o files.json` on each checkpoint. 
5. Change the `files.json` to the following and `sudo crit encode -i files.json -o files.img` for each afterwards.

In A's checkpoint (client), I have:
```
                "src_addr": [
                    "192.168.1.131"
                ], 
                "dst_addr": [
                    "192.168.1.104"
                ],
```

Change this to:

```
                "src_addr": [
                    "192.168.1.104"
                ], 
                "dst_addr": [
                    "192.168.1.131"
                ],
```

In B's checkpoint (server), we have:

```
                "src_addr": [
                    "::ffff:c0a8:168"
                ], 
                "dst_addr": [
                    "::ffff:c0a8:183"
                ], 
```

Change this to:

```
                "src_addr": [
                    "::ffff:c0a8:183"
                ], 
                "dst_addr": [
                    "::ffff:c0a8:168"
                ], 
```

6. Restore server B on host X and client A on host Y, using on each `sudo runc restore [container] ... --tcp-established`.

This results in an error on the client "Connection reset by peer". 

`tcpdump` for the exchange, captured on host X:
```
16:02:14.346058 IP 192.168.1.104.5672 > 192.168.1.131.55618: Flags [.], ack 3884, win 235, options [nop,nop,TS val 1681065902 ecr 807468738], length 0
16:02:15.349597 IP 192.168.1.131.55618 > 192.168.1.104.5672: Flags [P.], seq 3884:3906, ack 1, win 237, options [nop,nop,TS val 807469742 ecr 1681065902], length 22
16:02:15.349734 IP 192.168.1.131.55618 > 192.168.1.104.5672: Flags [P.], seq 3906:3928, ack 1, win 237, options [nop,nop,TS val 807469742 ecr 1681065902], length 22
16:02:15.349816 IP 192.168.1.131.55618 > 192.168.1.104.5672: Flags [P.], seq 3928:3958, ack 1, win 237, options [nop,nop,TS val 807469742 ecr 1681065902], length 30
16:02:15.349877 IP 192.168.1.104.5672 > 192.168.1.131.55618: Flags [.], ack 3906, win 235, options [nop,nop,TS val 1681066906 ecr 807469742], length 0
16:02:15.351975 IP 192.168.1.104.5672 > 192.168.1.131.55618: Flags [.], ack 3928, win 235, options [nop,nop,TS val 1681066906 ecr 807469742], length 0
16:02:15.352015 IP 192.168.1.104.5672 > 192.168.1.131.55618: Flags [.], ack 3958, win 235, options [nop,nop,TS val 1681066906 ecr 807469742], length 0
16:18:16.357123 IP 192.168.1.131.5672 > 192.168.1.104.55618: Flags [.], ack 4080654881, win 1460, options [nop,nop,TS val 1681067297 ecr 0], length 0
16:18:16.357466 IP 192.168.1.104.55618 > 192.168.1.131.5672: Flags [R], seq 4080654881, win 0, length 0
```

I assume I need to change something more, or else the router interfered somehow because it didn't expect the switch.

I did see [https://criu.org/Change_IP_address](https://criu.org/Change_IP_address), but `inetsk.img` doesn't exist anymore, it seems.

**Comment by avagin** [comment]
You run tcpdump without --absolute-tcp-sequence-numbers, and in this case, it is impossible to compare sequence numbers.

Could you reproduce this issue again, collect tcpdump with --absolute-tcp-sequence-numbers and attach files.img for both containers?

**Comment by dav-ell** [comment]
On the side that began with the client (host X in the example, IP `192.168.1.131`):

tcpdump (`tcpdump -nvvv -r tcpdump.log 'port 5672'`):
```
08:50:06.079047 IP (tos 0x0, ttl 64, id 16458, offset 0, flags [DF], proto TCP (6), length 74)
    192.168.1.131.51338 > 192.168.1.104.5672: Flags [P.], cksum 0x8478 (incorrect -> 0xeb2b), seq 24303:24325, ack 41, win 237, options [nop,nop,TS val 859280411 ecr 562792917], length 22
08:50:06.079174 IP (tos 0x0, ttl 64, id 16459, offset 0, flags [DF], proto TCP (6), length 104)
    192.168.1.131.51338 > 192.168.1.104.5672: Flags [P.], cksum 0x8496 (incorrect -> 0x1686), seq 24325:24377, ack 41, win 237, options [nop,nop,TS val 859280411 ecr 562792917], length 52
08:50:06.079361 IP (tos 0x0, ttl 64, id 10608, offset 0, flags [DF], proto TCP (6), length 52)
    192.168.1.104.5672 > 192.168.1.131.51338: Flags [.], cksum 0x335e (correct), seq 41, ack 24325, win 235, options [nop,nop,TS val 562793919 ecr 859280411], length 0
08:50:06.079383 IP (tos 0x0, ttl 64, id 10609, offset 0, flags [DF], proto TCP (6), length 52)
    192.168.1.104.5672 > 192.168.1.131.51338: Flags [.], cksum 0x332a (correct), seq 41, ack 24377, win 235, options [nop,nop,TS val 562793919 ecr 859280411], length 0
08:50:07.081565 IP (tos 0x0, ttl 64, id 16460, offset 0, flags [DF], proto TCP (6), length 74)
    192.168.1.131.51338 > 192.168.1.104.5672: Flags [P.], cksum 0x8478 (incorrect -> 0xe30c), seq 24377:24399, ack 41, win 237, options [nop,nop,TS val 859281414 ecr 562793919], length 22
08:50:07.081670 IP (tos 0x0, ttl 64, id 16461, offset 0, flags [DF], proto TCP (6), length 104)
    192.168.1.131.51338 > 192.168.1.104.5672: Flags [P.], cksum 0x8496 (incorrect -> 0x0d67), seq 24399:24451, ack 41, win 237, options [nop,nop,TS val 859281414 ecr 562793919], length 52
08:50:07.081917 IP (tos 0x0, ttl 64, id 10610, offset 0, flags [DF], proto TCP (6), length 52)
    192.168.1.104.5672 > 192.168.1.131.51338: Flags [.], cksum 0x2b3e (correct), seq 41, ack 24399, win 235, options [nop,nop,TS val 562794922 ecr 859281414], length 0
08:50:07.081939 IP (tos 0x0, ttl 64, id 10611, offset 0, flags [DF], proto TCP (6), length 52)
    192.168.1.104.5672 > 192.168.1.131.51338: Flags [.], cksum 0x2b0a (correct), seq 41, ack 24451, win 235, options [nop,nop,TS val 562794922 ecr 859281414], length 0
08:50:08.083524 IP (tos 0x0, ttl 64, id 16462, offset 0, flags [DF], proto TCP (6), length 74)
    192.168.1.131.51338 > 192.168.1.104.5672: Flags [P.], cksum 0x8478 (incorrect -> 0xdaee), seq 24451:24473, ack 41, win 237, options [nop,nop,TS val 859282415 ecr 562794922], length 22
08:50:08.083879 IP (tos 0x0, ttl 64, id 16463, offset 0, flags [DF], proto TCP (6), length 74)
    192.168.1.131.51338 > 192.168.1.104.5672: Flags [P.], cksum 0x8478 (incorrect -> 0xc31b), seq 24473:24495, ack 41, win 237, options [nop,nop,TS val 859282416 ecr 562794922], length 22
08:50:08.083999 IP (tos 0x0, ttl 64, id 16464, offset 0, flags [DF], proto TCP (6), length 82)
    192.168.1.131.51338 > 192.168.1.104.5672: Flags [P.], cksum 0x8480 (incorrect -> 0x6816), seq 24495:24525, ack 41, win 237, options [nop,nop,TS val 859282416 ecr 562794922], length 30
08:50:08.101692 IP (tos 0x0, ttl 64, id 16465, offset 0, flags [DF], proto TCP (6), length 82)
    192.168.1.131.51338 > 192.168.1.104.5672: Flags [P.], cksum 0x8480 (incorrect -> 0x6804), seq 24495:24525, ack 41, win 237, options [nop,nop,TS val 859282434 ecr 562794922], length 30
08:50:08.303832 IP (tos 0x0, ttl 64, id 16466, offset 0, flags [DF], proto TCP (6), length 126)
    192.168.1.131.51338 > 192.168.1.104.5672: Flags [P.], cksum 0x84ac (incorrect -> 0xb759), seq 24451:24525, ack 41, win 237, options [nop,nop,TS val 859282636 ecr 562794922], length 74
08:58:45.865016 IP (tos 0x0, ttl 64, id 43798, offset 0, flags [DF], proto TCP (6), length 52)
    192.168.1.131.5672 > 192.168.1.104.51338: Flags [.], cksum 0x8462 (incorrect -> 0xee4e), seq 71371823, ack 2393950788, win 1463, options [nop,nop,TS val 562795736 ecr 0], length 0
08:58:45.865296 IP (tos 0x0, ttl 64, id 63414, offset 0, flags [DF], proto TCP (6), length 40)
    192.168.1.104.51338 > 192.168.1.131.5672: Flags [R], cksum 0xf3fc (correct), seq 2393950788, win 0, length 0
08:58:46.003476 IP (tos 0x0, ttl 64, id 46742, offset 0, flags [DF], proto TCP (6), length 52)
    192.168.1.104.51338 > 192.168.1.131.5672: Flags [.], cksum 0xd33b (correct), seq 0, ack 1, win 1455, options [nop,nop,TS val 859283015 ecr 0], length 0
08:58:46.003565 IP (tos 0x0, ttl 64, id 28640, offset 0, flags [DF], proto TCP (6), length 40)
    192.168.1.131.5672 > 192.168.1.104.51338: Flags [R], cksum 0x3c81 (correct), seq 71371824, win 0, length 0
```

`files.img` before and after modification. This img is the server files.img, since the server was moved from host Y to host X, and modification of files.img was done on the receiving host.

[files-before-mod-server.img.txt](https://github.com/checkpoint-restore/criu/files/1825045/files-before-server.img.txt)
[files-after-mod-server.img.txt](https://github.com/checkpoint-restore/criu/files/1825046/files-after-server.img.txt)

**Comment by dav-ell** [comment]
On the side that began with the client (host X in the example, IP `192.168.1.104`):

tcpdump (`tcpdump -nvvv -r tcpdump.log 'port 5672'`):
```
08:50:06.080140 IP (tos 0x0, ttl 64, id 16458, offset 0, flags [DF], proto TCP (6), length 74)
    192.168.1.131.51338 > 192.168.1.104.5672: Flags [P.], cksum 0xeb2b (correct), seq 24230:24252, ack 41, win 237, options [nop,nop,TS val 859280411 ecr 562792917], length 22
08:50:06.080188 IP (tos 0x0, ttl 64, id 10608, offset 0, flags [DF], proto TCP (6), length 52)
    192.168.1.104.5672 > 192.168.1.131.51338: Flags [.], cksum 0x8462 (incorrect -> 0x335e), seq 41, ack 24252, win 235, options [nop,nop,TS val 562793919 ecr 859280411], length 0
08:50:06.080227 IP (tos 0x0, ttl 64, id 16459, offset 0, flags [DF], proto TCP (6), length 104)
    192.168.1.131.51338 > 192.168.1.104.5672: Flags [P.], cksum 0x1686 (correct), seq 24252:24304, ack 41, win 237, options [nop,nop,TS val 859280411 ecr 562792917], length 52
08:50:06.080243 IP (tos 0x0, ttl 64, id 10609, offset 0, flags [DF], proto TCP (6), length 52)
    192.168.1.104.5672 > 192.168.1.131.51338: Flags [.], cksum 0x8462 (incorrect -> 0x332a), seq 41, ack 24304, win 235, options [nop,nop,TS val 562793919 ecr 859280411], length 0
08:50:07.082685 IP (tos 0x0, ttl 64, id 16460, offset 0, flags [DF], proto TCP (6), length 74)
    192.168.1.131.51338 > 192.168.1.104.5672: Flags [P.], cksum 0xe30c (correct), seq 24304:24326, ack 41, win 237, options [nop,nop,TS val 859281414 ecr 562793919], length 22
08:50:07.082726 IP (tos 0x0, ttl 64, id 10610, offset 0, flags [DF], proto TCP (6), length 52)
    192.168.1.104.5672 > 192.168.1.131.51338: Flags [.], cksum 0x8462 (incorrect -> 0x2b3e), seq 41, ack 24326, win 235, options [nop,nop,TS val 562794922 ecr 859281414], length 0
08:50:07.082763 IP (tos 0x0, ttl 64, id 16461, offset 0, flags [DF], proto TCP (6), length 104)
    192.168.1.131.51338 > 192.168.1.104.5672: Flags [P.], cksum 0x0d67 (correct), seq 24326:24378, ack 41, win 237, options [nop,nop,TS val 859281414 ecr 562793919], length 52
08:50:07.082775 IP (tos 0x0, ttl 64, id 10611, offset 0, flags [DF], proto TCP (6), length 52)
    192.168.1.104.5672 > 192.168.1.131.51338: Flags [.], cksum 0x8462 (incorrect -> 0x2b0a), seq 41, ack 24378, win 235, options [nop,nop,TS val 562794922 ecr 859281414], length 0
08:50:08.086087 IP (tos 0x0, ttl 64, id 16462, offset 0, flags [DF], proto TCP (6), length 74)
    192.168.1.131.51338 > 192.168.1.104.5672: Flags [P.], cksum 0xdaee (correct), seq 24378:24400, ack 41, win 237, options [nop,nop,TS val 859282415 ecr 562794922], length 22
08:50:08.086153 IP (tos 0x0, ttl 64, id 16463, offset 0, flags [DF], proto TCP (6), length 74)
    192.168.1.131.51338 > 192.168.1.104.5672: Flags [P.], cksum 0xc31b (correct), seq 24400:24422, ack 41, win 237, options [nop,nop,TS val 859282416 ecr 562794922], length 22
08:50:08.086162 IP (tos 0x0, ttl 64, id 16464, offset 0, flags [DF], proto TCP (6), length 82)
    192.168.1.131.51338 > 192.168.1.104.5672: Flags [P.], cksum 0x6816 (correct), seq 24422:24452, ack 41, win 237, options [nop,nop,TS val 859282416 ecr 562794922], length 30
08:50:08.102923 IP (tos 0x0, ttl 64, id 16465, offset 0, flags [DF], proto TCP (6), length 82)
    192.168.1.131.51338 > 192.168.1.104.5672: Flags [P.], cksum 0x6804 (correct), seq 24422:24452, ack 41, win 237, options [nop,nop,TS val 859282434 ecr 562794922], length 30
08:50:08.304907 IP (tos 0x0, ttl 64, id 16466, offset 0, flags [DF], proto TCP (6), length 126)
    192.168.1.131.51338 > 192.168.1.104.5672: Flags [P.], cksum 0xb759 (correct), seq 24378:24452, ack 41, win 237, options [nop,nop,TS val 859282636 ecr 562794922], length 74
08:58:45.866091 IP (tos 0x0, ttl 64, id 43798, offset 0, flags [DF], proto TCP (6), length 52)
    192.168.1.131.5672 > 192.168.1.104.51338: Flags [.], cksum 0xee4e (correct), seq 71371823, ack 2393950788, win 1463, options [nop,nop,TS val 562795736 ecr 0], length 0
08:58:45.866153 IP (tos 0x0, ttl 64, id 63414, offset 0, flags [DF], proto TCP (6), length 40)
    192.168.1.104.51338 > 192.168.1.131.5672: Flags [R], cksum 0xf3fc (correct), seq 2393950788, win 0, length 0
08:58:46.004159 IP (tos 0x0, ttl 64, id 46742, offset 0, flags [DF], proto TCP (6), length 52)
    192.168.1.104.51338 > 192.168.1.131.5672: Flags [.], cksum 0x8462 (incorrect -> 0xd33b), seq 0, ack 1, win 1455, options [nop,nop,TS val 859283015 ecr 0], length 0
08:58:46.004581 IP (tos 0x0, ttl 64, id 28640, offset 0, flags [DF], proto TCP (6), length 40)
    192.168.1.131.5672 > 192.168.1.104.51338: Flags [R], cksum 0x3c81 (correct), seq 71371824, win 0, length 0
```

files.img before and after modification. This img is the client's files.img.

[files-before-client.img.txt](https://github.com/checkpoint-restore/criu/files/1825065/files-before-client.img.txt)
[files-after-client.img.txt](https://github.com/checkpoint-restore/criu/files/1825066/files-after-client.img.txt)

**Comment by avagin** [comment]
What criu version do you use?

**Comment by avagin** [comment]
Could you attach  tcp-stream-*.img images too? I see that sequence numbers are restored incorrectly.

**Comment by dav-ell** [comment]
> What criu version do you use?

CRIU Version: 3.7

**Comment by avagin** [comment]
Could you check that after dumpi, you have iptables rules which block traffic of this connection?

**Comment by dav-ell** [comment]
The server has three tcp-stream-*.img files:

[tcp-stream-26b5f.img.txt](https://github.com/checkpoint-restore/criu/files/1826338/tcp-stream-26b5f.img.txt)
[tcp-stream-270ff.img.txt](https://github.com/checkpoint-restore/criu/files/1826341/tcp-stream-270ff.img.txt)
[tcp-stream-276a6.img.txt](https://github.com/checkpoint-restore/criu/files/1826344/tcp-stream-276a6.img.txt)

**Comment by dav-ell** [comment]
The client has one:

[tcp-stream-31406.img.txt](https://github.com/checkpoint-restore/criu/files/1826347/tcp-stream-31406.img.txt)

**Comment by avagin** [comment]
```
./crit/crit show ~/Downloads/tcp-stream-31406.img.txt 
{
    "magic": "TCP_STREAM", 
    "entries": [
        {
            "inq_len": 0, 
            "inq_seq": 71371824, 
            "outq_len": 74, 
            "outq_seq": 2393950862, 
            "opt_mask": "0x7", 
            "snd_wscale": 7, 
            "mss_clamp": 1460, 
            "rcv_wscale": 7, 
            "timestamp": 859282912, 
            "nodelay": true, 
            "unsq_len": 0, 
            "snd_wl1": 71371824, 
            "snd_wnd": 30080, 
            "max_window": 30080, 
            "rcv_wnd": 30336, 
            "rcv_wup": 71371824, 
            "extra": {
                "outq": "AQABAAAADgA8ACgAAAAFaGVsbG8AzgIAAQAAAA4APAAAAAAAAAAAABYAAM4DAAEAAAAWSGVsbG8g\nV29ybGQgbnVtYmVyIDM0OM4=\n", 
                "inq": ""
            }
        }
    ]
}
```

**Comment by dav-ell** [comment]
Not sure about what iptable rule to look for, but here's what I got with `sudo iptables --list-rules`:

```
$ sudo iptables --list-rules
-P INPUT ACCEPT
-P FORWARD DROP
-P OUTPUT ACCEPT
-N DOCKER
-N DOCKER-ISOLATION
-N DOCKER-USER
-A INPUT -s 127.0.0.1/32 -d 127.0.0.1/32 -p tcp -m mark ! --mark 0xc114 -m tcp --sport 42711 --dport 4369 -j DROP
-A INPUT -s 192.168.1.131/32 -d 192.168.1.104/32 -p tcp -m mark ! --mark 0xc114 -m tcp --sport 51338 --dport 5672 -j DROP
-A INPUT -s 127.0.0.1/32 -d 127.0.0.1/32 -p tcp -m mark ! --mark 0xc114 -m tcp --sport 4369 --dport 42711 -j DROP
-A INPUT -s 127.0.0.1/32 -d 127.0.0.1/32 -p tcp -m mark ! --mark 0xc114 -m tcp --sport 37031 --dport 4369 -j DROP
-A INPUT -s 192.168.1.131/32 -d 192.168.1.104/32 -p tcp -m mark ! --mark 0xc114 -m tcp --sport 51302 --dport 5672 -j DROP
-A INPUT -s 127.0.0.1/32 -d 127.0.0.1/32 -p tcp -m mark ! --mark 0xc114 -m tcp --sport 4369 --dport 37031 -j DROP
-A FORWARD -j DOCKER-USER
-A FORWARD -j DOCKER-ISOLATION
-A FORWARD -o docker0 -m conntrack --ctstate RELATED,ESTABLISHED -j ACCEPT
-A FORWARD -o docker0 -j DOCKER
-A FORWARD -i docker0 ! -o docker0 -j ACCEPT
-A FORWARD -i docker0 -o docker0 -j ACCEPT
-A OUTPUT -s 127.0.0.1/32 -d 127.0.0.1/32 -p tcp -m mark ! --mark 0xc114 -m tcp --sport 4369 --dport 42711 -j DROP
-A OUTPUT -s 192.168.1.104/32 -d 192.168.1.131/32 -p tcp -m mark ! --mark 0xc114 -m tcp --sport 5672 --dport 51338 -j DROP
-A OUTPUT -s 127.0.0.1/32 -d 127.0.0.1/32 -p tcp -m mark ! --mark 0xc114 -m tcp --sport 42711 --dport 4369 -j DROP
-A OUTPUT -s 127.0.0.1/32 -d 127.0.0.1/32 -p tcp -m mark ! --mark 0xc114 -m tcp --sport 4369 --dport 37031 -j DROP
-A OUTPUT -s 192.168.1.104/32 -d 192.168.1.131/32 -p tcp -m mark ! --mark 0xc114 -m tcp --sport 5672 --dport 51302 -j DROP
-A OUTPUT -s 127.0.0.1/32 -d 127.0.0.1/32 -p tcp -m mark ! --mark 0xc114 -m tcp --sport 37031 --dport 4369 -j DROP
-A DOCKER-ISOLATION -j RETURN
-A DOCKER-USER -j RETURN
```

**Comment by avagin** [comment]
```
$ ./crit/crit show ~/Downloads/tcp-stream-276a6.img.txt 
{
    "magic": "TCP_STREAM", 
    "entries": [
        {
            "inq_len": 0, 
            "inq_seq": 2393950788, 
            "outq_len": 0, 
            "outq_seq": 71371824, 
            "opt_mask": "0x7", 
            "snd_wscale": 7, 
            "mss_clamp": 1460, 
            "rcv_wscale": 7, 
            "timestamp": 562795550, 
            "nodelay": true, 
            "unsq_len": 0, 
            "snd_wl1": 2393947302, 
            "snd_wnd": 30336, 
            "max_window": 30336, 
            "rcv_wnd": 30080, 
            "rcv_wup": 2393950788, 
            "extra": {
                "outq": "", 
                "inq": ""
            }
        }
    ]
}
```

**Comment by dav-ell** [comment]
> We use iptables to block any traffic of a dumped tcp connections between checkpoint/restore

What is the reason for this? Is there a risk that the OS will reset the connection when it sees the container is gone?

> When you move connections between hosts, you need to move this iptabels rules too, and you need too replace ip addresses in them too.

Well, I went one short of switching the ip table rules and instead just deleted all the ip table rules with --mark 0xc114 (is this a CRIU tag?), and that got it to work. It's actually pretty cool that this works. Thanks a lot for the help.

**Comment by dav-ell** [comment]
As an extra note... would it be useful to write a doc on how to get this to work? Would you guys post that?

**Comment by avagin** [comment]
@dav-ell If you write this doc, we definitely will post it! Thank you for the interest to CRIU.
