### ISSUE TITLE
Moving a TCP-connected client to a new host causes connection reset

### ISSUE THREAD

**Issue by dav-ell** [checkpoint-restore/criu#461]
I am attempting almost exactly the same thing as #454, but instead of swapping the client and the server, I am simply trying to move the client to a new host and running restore. Here's more detail about the setup.

I have three virtual machines with bridged adapters, with IP addresses and what containers are running on them at the beginning like so:
* VM 1: `192.168.1.149` - server
* VM 2: `192.168.1.131` - client
* VM 3: `192.168.1.104` - nothing

At the end, I have the VM's and containers changed to this:

* VM 1: `192.168.1.149` - server
* VM 2: `192.168.1.131` - nothing
* VM 3: `192.168.1.104` - client

Steps:
1. Checkpoint the client and the server at roughly the same time.
2. Transfer the client to VM 3, change the `src_addr` in `files.img` to `192.168.1.104`, replacing the old value of `192.168.1.131`. Leave the port the same.
3. Leave the server where it is and change the `dst_addr` in `files.img` to `::ffff:c0a8:168` from `::ffff:c0a8:183` (each of those are the direct IPv4 to IPv6 conversions from `192.168.1.104` and `192.168.1.131`, respectively). Leave the port the same.
4. Delete all iptables rules that include `0xc114` in the line.
5. Restore them both at roughly the same time. This gives an error on the client: 
```
Error: read ECONNRESET
    at TCP.onread (net.js:619:25)
```

The tcpdump log looks like this:
```
09:39:06.353257 IP 192.168.1.131.41082 > 192.168.1.149.5672: Flags [P.], seq 2372971479:2372971550, ack 369210948, win 237, options [nop,nop,TS val 1831377437 ecr 3710826735], length 71
09:39:06.353275 IP 192.168.1.149.5672 > 192.168.1.131.41082: Flags [.], ack 2372971550, win 235, options [nop,nop,TS val 3710826735 ecr 1831377437], length 0
09:39:06.353341 IP 192.168.1.149.5672 > 192.168.1.131.41082: Flags [P.], seq 369210948:369210974, ack 2372971550, win 235, options [nop,nop,TS val 3710826735 ecr 1831377437], length 26
09:39:06.353475 IP 192.168.1.131.41082 > 192.168.1.149.5672: Flags [.], ack 369210974, win 237, options [nop,nop,TS val 1831377437 ecr 3710826735], length 0
09:39:07.354132 IP 192.168.1.131.41082 > 192.168.1.149.5672: Flags [P.], seq 2372971550:2372971575, ack 369210974, win 237, options [nop,nop,TS val 1831378437 ecr 3710826735], length 25
09:39:07.354488 IP 192.168.1.149.5672 > 192.168.1.131.41082: Flags [P.], seq 369210974:369211000, ack 2372971575, win 235, options [nop,nop,TS val 3710827737 ecr 1831378437], length 26
09:39:07.354746 IP 192.168.1.131.41082 > 192.168.1.149.5672: Flags [P.], seq 2372971575:2372971646, ack 369211000, win 237, options [nop,nop,TS val 1831378438 ecr 3710827737], length 71
09:39:07.398769 IP 192.168.1.149.5672 > 192.168.1.131.41082: Flags [.], ack 2372971646, win 235, options [nop,nop,TS val 3710827737 ecr 1831378438], length 0
09:42:37.479877 IP 192.168.1.149.5672 > 192.168.1.104.41082: Flags [.], ack 2372971646, win 1463, options [nop,nop,TS val 3710828496 ecr 0], length 0
09:42:37.481277 IP 192.168.1.104.41082 > 192.168.1.149.5672: Flags [R], seq 2372971646, win 0, length 0
09:42:38.937585 IP 192.168.1.104.41082 > 192.168.1.149.5672: Flags [.], ack 369211000, win 1455, options [nop,nop,TS val 1831379341 ecr 0], length 0
09:42:38.937652 IP 192.168.1.149.5672 > 192.168.1.104.41082: Flags [R], seq 369211000, win 0, length 0
```
[tcpdump.txt](https://github.com/checkpoint-restore/criu/files/1848090/tcpdump.txt)

The containers I'm using are the [RabbitMQ server](https://hub.docker.com/_/rabbitmq/) (`rabbitmq:3-management`) and a RabbitMQ client built on Node. In #454 I was using a client built on Python, but I found [an article](http://www.itmaybeahack.com/homepage/iblog/architecture/C551260341/E20081031204203/index.html) that seemed to suggest the "connection reset by peer" error I was having was Python-specific. Unfortunately, after changing to Node, it didn't fix anything.

For the sake of thoroughness, the client code is below (mostly copy/pasted from the RabbitMQ tutorial):
```
#!/usr/bin/env node

var amqp = require('amqplib/callback_api');

function sleep(ms) {
    return new Promise(resolve => setTimeout(resolve, ms));
}

amqp.connect('amqp://user:password@192.168.1.149', function (err, conn) {
    if (err) {
        console.error("Connection error: " + err)
    }
    conn.createChannel(async function (err, ch) {
        var counter = 0;
        var q = 'hello';
        while (true) {
            var msg = `Hello World! ${counter++}`;

            ch.assertQueue(q, { durable: false });
            ch.sendToQueue(q, new Buffer(msg));
            console.log(" [x] Sent %s", msg);
            await sleep(1000);
        }
    });
});
```

**Comment by dav-ell** [comment]
Client images:
[client-files.img.txt](https://github.com/checkpoint-restore/criu/files/1848152/client-files.img.txt)
[tcp-stream-6a5c3.img.txt](https://github.com/checkpoint-restore/criu/files/1848154/tcp-stream-6a5c3.img.txt)
[tcp-stream-34f78.img.txt](https://github.com/checkpoint-restore/criu/files/1848156/tcp-stream-34f78.img.txt)

**Comment by dav-ell** [comment]
Server images:
[files.img.txt](https://github.com/checkpoint-restore/criu/files/1848173/files.img.txt)
[tcp-stream-6188c.img.txt](https://github.com/checkpoint-restore/criu/files/1848170/tcp-stream-6188c.img.txt)
[tcp-stream-60cfe.img.txt](https://github.com/checkpoint-restore/criu/files/1848171/tcp-stream-60cfe.img.txt)
[tcp-stream-6054d.img.txt](https://github.com/checkpoint-restore/criu/files/1848172/tcp-stream-6054d.img.txt)

**Comment by dav-ell** [comment]
In #454 I got almost exactly the same scenario to work as above. Seemingly, the only difference was that both hosts involved in the connection already had a connection before the restore, whereas in this scenario, VM 1 and 3 have never had a connection until I restore the containers with modified checkpoints. Therefore, it seemed possible that the router was causing the connection reset after seeing a connection that shouldn't have been active suddenly become active.

As a temporary solution, I tried the slightly more advanced scenario:

* VM 1: `192.168.1.149` - server hosted on port 5672
* VM 2: `192.168.1.131` - client A connected to the server through port 50000
* VM 3: `192.168.1.104` - client B connected to the server through port 50001

At the end, changed to this:

* VM 1: `192.168.1.149` - server hosted on port 5672
* VM 2: `192.168.1.131` - client B connected to the server through port 50000
* VM 3: `192.168.1.104` - client A connected to the server through port 50001

The (supposed) improvement in this scenario is that I could make use of the fact that the router had seen a connection between VM 1 and VM 3 on a certain port prior to the final restore. I figured that if I changed the TCP connection information to include the changed addresses _and_ a changed port, then it might work. Unfortunately, it did not, and both clients got the same error. This, however, was when both clients were Python-based. If you're interested, I can include more information from this scenario as well.

**Comment by dav-ell** [comment]
I made a few adjustments to the system described in the previous comment, tested again, and it worked. 

This time I changed the VM network adapters to Host-only adapters so that they could still communicate without the need of a physical router. I then tested exactly as in the comment above but with the Node-based containers instead of Python-based containers. They continued fine just as they left off.

**Comment by avagin** [comment]
> 4. Delete all iptables rules that include 0xc114 in the line.

You can't do this. All traffic in dumped connections has to be blocked. Otherwise a connection can be restored incorrectly and it may be a reason of this issue.

**Comment by dav-ell** [comment]
> You can't do this. All traffic in dumped connections has to be blocked. Otherwise a connection can be restored incorrectly and it may be a reason of this issue.

I'll try this, but I don't understand at all why this is the case. Is there somewhere you can point me or is there a quick way of understanding why the traffic has to be blocked? It seems that those iptable rules are removed on restore. I assume only after certain events have occurred in the restore process that it's okay to remove them?

**Comment by avagin** [comment]
Restore of tcp sockets is a complicated process and it is not atomic. We create a socket, then we call bind() and connect() to restore source and destination addresses, then we adjust sequence numbers and other parameters.

From your tcpdump, one side sends a packet before another side completes restoring its socket, and the remote side answers by a reset packet. It is possible if the remote side has restored source and destination addresses, but doesn't adjust sequence numbers yet.

On restore, iptables rules are removed only after restoring all sockets.

**Comment by dav-ell** [comment]
> Restore of tcp sockets is a complicated process and it is not atomic. We create a socket, then we call bind() and connect() to restore source and destination addresses, then we adjust sequence numbers and other parameters.

Thanks for the explanation, that helps a lot.

> From your tcpdump, one side sends a packet before another side completes restoring its socket, and the remote side answers by a reset packet. It is possible if the remote side has restored source and destination addresses, but doesn't adjust sequence numbers yet.

This is probably what was happening, or else something similar to it. After editing the iptables rows to match my setup, the client stopped sending a reset. Unfortunately, after a short time the server sends a fin packet. Can you make sense of this log? It looks like the server enters a strange state and begins checking back with the client every 30 - 60 seconds, but no communication ever resumes, until eventually the server decides to end the connection after a couple minutes.

```
10:37:02.156461 IP 192.168.1.149.5672 > 192.168.1.132.50300: Flags [.], ack 3381714382, win 235, options [nop,nop,TS val 2783641499 ecr 2019356123], length 0
10:37:02.156622 IP 192.168.1.132.50300 > 192.168.1.149.5672: Flags [P.], seq 3381714382:3381714453, ack 1822308960, win 237, options [nop,nop,TS val 2019356124 ecr 2783641499], length 71
10:37:02.156651 IP 192.168.1.149.5672 > 192.168.1.132.50300: Flags [.], ack 3381714453, win 235, options [nop,nop,TS val 2783641500 ecr 2019356124], length 0
10:37:02.156801 IP 192.168.1.149.5672 > 192.168.1.132.50300: Flags [P.], seq 1822308960:1822308986, ack 3381714453, win 235, options [nop,nop,TS val 2783641500 ecr 2019356124], length 26
10:37:02.157739 IP 192.168.1.132.50300 > 192.168.1.149.5672: Flags [.], ack 1822308986, win 237, options [nop,nop,TS val 2019356124 ecr 2783641500], length 0
10:37:03.158591 IP 192.168.1.132.50300 > 192.168.1.149.5672: Flags [P.], seq 3381714453:3381714478, ack 1822308986, win 237, options [nop,nop,TS val 2019357125 ecr 2783641500], length 25
10:37:03.158945 IP 192.168.1.149.5672 > 192.168.1.132.50300: Flags [P.], seq 1822308986:1822309012, ack 3381714478, win 235, options [nop,nop,TS val 2783642502 ecr 2019357125], length 26
10:37:03.159170 IP 192.168.1.132.50300 > 192.168.1.149.5672: Flags [P.], seq 3381714478:3381714549, ack 1822309012, win 237, options [nop,nop,TS val 2019357126 ecr 2783642502], length 71
10:37:03.201897 IP 192.168.1.149.5672 > 192.168.1.132.50300: Flags [.], ack 3381714549, win 235, options [nop,nop,TS val 2783642502 ecr 2019357126], length 0

10:41:02.901012 IP 192.168.1.149.5672 > 192.168.1.105.50300: Flags [.], ack 3381714549, win 1463, options [nop,nop,TS val 2783644550 ecr 0], length 0
10:41:03.861517 IP 192.168.1.105.50300 > 192.168.1.149.5672: Flags [.], ack 1822309012, win 1455, options [nop,nop,TS val 2019357927 ecr 0], length 0
10:41:03.861568 IP 192.168.1.149.5672 > 192.168.1.105.50300: Flags [.], ack 3381714549, win 1463, options [nop,nop,TS val 2783645511 ecr 0], length 0
10:41:32.977554 IP 192.168.1.149.5672 > 192.168.1.105.50300: Flags [P.], seq 1822309012:1822309020, ack 3381714549, win 1463, options [nop,nop,TS val 2783674626 ecr 0], length 8
10:41:32.977890 IP 192.168.1.105.50300 > 192.168.1.149.5672: Flags [.], ack 1822309020, win 1455, options [nop,nop,TS val 2019387043 ecr 2783674626], length 0
10:42:32.979359 IP 192.168.1.149.5672 > 192.168.1.105.50300: Flags [P.], seq 1822309020:1822309028, ack 3381714549, win 1463, options [nop,nop,TS val 2783734628 ecr 2019387043], length 8
10:42:32.979779 IP 192.168.1.105.50300 > 192.168.1.149.5672: Flags [.], ack 1822309028, win 1455, options [nop,nop,TS val 2019447045 ecr 2783734628], length 0
10:43:02.980112 IP 192.168.1.149.5672 > 192.168.1.105.50300: Flags [F.], seq 1822309028, ack 3381714549, win 1463, options [nop,nop,TS val 2783764629 ecr 2019447045], length 0
10:43:02.982469 IP 192.168.1.105.50300 > 192.168.1.149.5672: Flags [F.], seq 3381714549, ack 1822309029, win 1455, options [nop,nop,TS val 2019477048 ecr 2783764629], length 0
10:43:02.982516 IP 192.168.1.149.5672 > 192.168.1.105.50300: Flags [.], ack 3381714550, win 1463, options [nop,nop,TS val 2783764631 ecr 2019477048], length 0
```

Heres' the same log with more detail: 
[tcpdump.txt](https://github.com/checkpoint-restore/criu/files/1856520/tcpdump.txt)

**Comment by dav-ell** [comment]
Here's a strange thing: in another test using a different starting and ending host for the client, it works. In the previous test where it sent the fin packet I was moving the client from VM 3 -> VM 2, and now I'm moving it from VM 2 -> VM 3. Here's the logs. I'm following the exact same procedure no matter where it starts and ends, so I don't yet understand why it would fail for one direction and not the other.

```
11:11:08.160480 IP 192.168.1.105.55816 > 192.168.1.149.5672: Flags [P.], seq 1100603869:1100603894, ack 1952533180, win 237, options [nop,nop,TS val 2042290336 ecr 1555476844], length 25
11:11:08.161735 IP 192.168.1.149.5672 > 192.168.1.105.55816: Flags [P.], seq 1952533180:1952533206, ack 1100603894, win 235, options [nop,nop,TS val 1555477846 ecr 2042290336], length 26
11:11:08.162040 IP 192.168.1.105.55816 > 192.168.1.149.5672: Flags [P.], seq 1100603894:1100603964, ack 1952533206, win 237, options [nop,nop,TS val 2042290337 ecr 1555477846], length 70
11:11:08.206818 IP 192.168.1.149.5672 > 192.168.1.105.55816: Flags [.], ack 1100603964, win 235, options [nop,nop,TS val 1555477846 ecr 2042290337], length 0
11:11:09.166931 IP 192.168.1.105.55816 > 192.168.1.149.5672: Flags [P.], seq 1100603964:1100603989, ack 1952533206, win 237, options [nop,nop,TS val 2042291342 ecr 1555477846], length 25
11:11:09.167007 IP 192.168.1.149.5672 > 192.168.1.105.55816: Flags [.], ack 1100603989, win 235, options [nop,nop,TS val 1555478851 ecr 2042291342], length 0
11:11:09.167394 IP 192.168.1.149.5672 > 192.168.1.105.55816: Flags [P.], seq 1952533206:1952533232, ack 1100603989, win 235, options [nop,nop,TS val 1555478851 ecr 2042291342], length 26
11:11:09.167787 IP 192.168.1.105.55816 > 192.168.1.149.5672: Flags [P.], seq 1100603989:1100604059, ack 1952533206, win 237, options [nop,nop,TS val 2042291343 ecr 1555478851], length 70
11:11:09.215102 IP 192.168.1.149.5672 > 192.168.1.105.55816: Flags [.], ack 1100604059, win 235, options [nop,nop,TS val 1555478852 ecr 2042291343], length 0
11:11:09.215197 IP 192.168.1.105.55816 > 192.168.1.149.5672: Flags [.], ack 1952533232, win 237, options [nop,nop,TS val 2042291343 ecr 1555478851], length 0

11:15:42.786276 IP 192.168.1.149.5672 > 192.168.1.132.55816: Flags [.], ack 1100604059, win 1463, options [nop,nop,TS val 1555481636 ecr 0], length 0
11:15:43.668658 IP 192.168.1.132.55816 > 192.168.1.149.5672: Flags [.], ack 1952533232, win 1455, options [nop,nop,TS val 2042292586 ecr 0], length 0
11:15:43.668709 IP 192.168.1.149.5672 > 192.168.1.132.55816: Flags [.], ack 1100604059, win 1463, options [nop,nop,TS val 1555482519 ecr 0], length 0
11:15:43.706181 IP 192.168.1.132.55816 > 192.168.1.149.5672: Flags [P.], seq 1100604059:1100604084, ack 1952533232, win 1455, options [nop,nop,TS val 2042292623 ecr 1555482519], length 25
11:15:43.706244 IP 192.168.1.149.5672 > 192.168.1.132.55816: Flags [.], ack 1100604084, win 1463, options [nop,nop,TS val 1555482556 ecr 2042292623], length 0
11:15:43.707040 IP 192.168.1.149.5672 > 192.168.1.132.55816: Flags [P.], seq 1952533232:1952533258, ack 1100604084, win 1463, options [nop,nop,TS val 1555482557 ecr 2042292623], length 26
11:15:43.711230 IP 192.168.1.132.55816 > 192.168.1.149.5672: Flags [.], ack 1952533258, win 1455, options [nop,nop,TS val 2042292628 ecr 1555482557], length 0
11:15:43.711670 IP 192.168.1.132.55816 > 192.168.1.149.5672: Flags [P.], seq 1100604084:1100604154, ack 1952533258, win 1455, options [nop,nop,TS val 2042292629 ecr 1555482557], length 70
11:15:43.754135 IP 192.168.1.149.5672 > 192.168.1.132.55816: Flags [.], ack 1100604154, win 1463, options [nop,nop,TS val 1555482562 ecr 2042292629], length 0
11:15:44.708561 IP 192.168.1.132.55816 > 192.168.1.149.5672: Flags [P.], seq 1100604154:1100604179, ack 1952533258, win 1455, options [nop,nop,TS val 2042293626 ecr 1555482562], length 25
11:15:44.708620 IP 192.168.1.149.5672 > 192.168.1.132.55816: Flags [.], ack 1100604179, win 1463, options [nop,nop,TS val 1555483559 ecr 2042293626], length 0
```

Normal tcpdump: 
[tcpdump.txt](https://github.com/checkpoint-restore/criu/files/1856578/tcpdump.txt)
tcpdump with extra detail:
[tcpdump-detailed.txt](https://github.com/checkpoint-restore/criu/files/1856587/tcpdump-detailed.txt)

**Comment by avagin** [comment]
```
10:37:03.159170 IP 192.168.1.132.50300 > 192.168.1.149.5672: Flags [P.], seq 3381714478:3381714549, ack 1822309012, win 237, options [nop,nop,TS val 2019357126 ecr 2783642502], length 71
10:37:03.201897 IP 192.168.1.149.5672 > 192.168.1.132.50300: Flags [.], ack 3381714549, win 235, options [nop,nop,TS val 2783642502 ecr 2019357126], length 0

10:41:02.901012 IP 192.168.1.149.5672 > 192.168.1.105.50300: Flags [.], ack 3381714549, win 1463, options [nop,nop,TS val 2783644550 ecr 0], length 0
10:41:03.861517 IP 192.168.1.105.50300 > 192.168.1.149.5672: Flags [.], ack 1822309012, win 1455, options [nop,nop,TS val 2019357927 ecr 0], length 0
10:41:03.861568 IP 192.168.1.149.5672 > 192.168.1.105.50300: Flags [.], ack 3381714549, win 1463, options [nop,nop,TS val 2783645511 ecr 0], length 0
```

This looks like that some iptables rules was not removed. You need to check that all iptables rules that include 0xc114 disappeared after restore.

**Comment by dav-ell** [comment]
Here's what I did, moving a client from VM 2 to VM 3:

1. Run, checkpoint, copy checkpoint and modify tcp connections as usual.
2. Copy iptables rules from VM 2 to VM 3, and modify just the IP addresses.

```
-A INPUT -s 192.168.1.149/32 -d 192.168.1.132/32 -p tcp -m mark ! --mark 0xc114 -m tcp --sport 5672 --dport 50346 -j DROP
-A OUTPUT -s 192.168.1.132/32 -d 192.168.1.149/32 -p tcp -m mark ! --mark 0xc114 -m tcp --sport 50346 --dport 5672 -j DROP
```
to
```
-A INPUT -s 192.168.1.149/32 -d 192.168.1.105/32 -p tcp -m mark ! --mark 0xc114 -m tcp --sport 5672 --dport 50346 -j DROP
-A OUTPUT -s 192.168.1.105/32 -d 192.168.1.149/32 -p tcp -m mark ! --mark 0xc114 -m tcp --sport 50346 --dport 5672 -j DROP
```

3. Modify the iptables rules for the server. 
```
-A INPUT -s 127.0.0.1/32 -d 127.0.0.1/32 -p tcp -m mark ! --mark 0xc114 -m tcp --sport 37955 --dport 4369 -j DROP
-A INPUT -s 192.168.1.132/32 -d 192.168.1.149/32 -p tcp -m mark ! --mark 0xc114 -m tcp --sport 50346 --dport 5672 -j DROP
-A INPUT -s 127.0.0.1/32 -d 127.0.0.1/32 -p tcp -m mark ! --mark 0xc114 -m tcp --sport 4369 --dport 37955 -j DROP
-A OUTPUT -s 127.0.0.1/32 -d 127.0.0.1/32 -p tcp -m mark ! --mark 0xc114 -m tcp --sport 4369 --dport 37955 -j DROP
-A OUTPUT -s 192.168.1.149/32 -d 192.168.1.132/32 -p tcp -m mark ! --mark 0xc114 -m tcp --sport 5672 --dport 50346 -j DROP
-A OUTPUT -s 127.0.0.1/32 -d 127.0.0.1/32 -p tcp -m mark ! --mark 0xc114 -m tcp --sport 37955 --dport 4369 -j DROP
```

to
```
...
-A INPUT -s 192.168.1.105/32 -d 192.168.1.149/32 -p tcp -m mark ! --mark 0xc114 -m tcp --sport 50346 --dport 5672 -j DROP
...
-A OUTPUT -s 192.168.1.149/32 -d 192.168.1.105/32 -p tcp -m mark ! --mark 0xc114 -m tcp --sport 5672 --dport 50346 -j DROP
...
```
4. Restore.

I check immediately after restore and all the iptables rules that include 0xc114 are gone, but I'm still getting the same issue.

**Comment by dav-ell** [comment]
> All traffic in dumped connections has to be blocked. Otherwise a connection can be restored incorrectly and it may be a reason of this issue.

> You need to check that all iptables rules that include 0xc114 disappeared after restore.

For reference, these comments resolved this issue for me. I have not been able to reproduce the later issue that I had.

Thanks again, @avagin.
